Original Text,Modified Text
"Closure of schools might lead to increased school dropouts. Is meeting the demand for higher education prep or even childhood obesity?
Trust Sensors argues that the closure of school districts will put more students into drugs and extreme risks for mental health. Based on the US Department of Education's Bridging the Classrooms Initiative (CNTL), children who attend high-poverty schools won't study at all and wouldn't reach high school grades because they're 'on","Cosure of schools migt leda to incrased school droouts. Is meeting the demadn for hiher educaion pep or veen childhood obesit? rTust Sensrs agrues that the closure of shcool idstricts will put moer students nito drugs and exreme riss for metal haelth. aBsed on the US Department of Educaiton's Briging the Classromos Initative (CNTL,) chldren who tatend hgh-poverty schools wno't study at all and would'nt erach hgih scholo grades ebcause they'er 'on"
"The project opportunities should be distributed evenly among all people.
I think Bungie really should include survival-comic-book-like environments within quests and challenges to ensure meeting completion goals won't leave you too bored early on. They'll likely be testing what things feel like and when it feels like they're broken before they abandon the plans.
""...and Billy Bunch will earn a nightfall code, hopefully doing so on Gibralter.""","The proect opportunities sohuld be distribted evelny aong all peope. I thik Bungie realy should inlude survival-comic-obok-like evnironments within quests and challenges to esure meting completion gols wont levae you too boed earyl on. hTey'll likely be testign waht thngs fel lkie and wen it feels like they're brokn before they abandno the plans. ""...and Bily Buch will ean a nighfall cod, hopefully doig so on Gibrlater."""
"What are problems associated with rape?  If the rape itself was consensual.  If the rape itself was consensual and he accused his girlfriend and then her boyfriend of raping her, would you report this?
I don't know. I'd wait for an official report, but I'm not seeing how that is a problem. I would report it if she was going to do it and wait until he asked.
Rape is a","Waht are prblems associated with raep? If the rape itself was consensua. If the rae itself was consenusal and he accusd his girlfriend and thn her boyriend of rpaing her, woud you reort thi?s I odn't konw. I'd wait for an officila repotr, but I'm not seing how taht is a problem. I would rport it if she was going to do it and wati until he aked. Rae is a"
"Farming is also a source of income for refugees. Foster parents don’t deflower their children, because they want the reality check offered. Sometimes even giving there kids to someone who immigrates will provide some spanking without breaking the bank. You know what they say: wait for the shit. Connor is only eight and he is not breaking the bank to raise his baby. This offends me, but I respect what he is trying to","Faring is laso a souce of income for refugees. oFster parents don’t deflwer their childrne, becuse thye wat the raelity ceck ofered. Somtimes even giving there ikds to someone who immigrates will rpovide some spankng without beraking the abnk. You nkow whta thy sy: wait for the shi.t Conor is oly eigth and he is not breaking the bank to raies his bbay. Ths offedns me, but I respetc wat he is triyng to"
"Public health should be the government's priority. This is not America. Political power is more important than defensible public health policies,"" St. Paul Mayor Melvin Carter said in a tweet.
Importantly, Trump's department will provide guidance for the revisions.
Acting District Attorney Mary Haskell also welcomed the Climate Tort Policy. ""If we protect our planet from climate change and decimate the forests that hold our food, that provides a credible,","Pbulic haelth sholud be the government's priortiy. Tis is not Amreica. Plitical poewr is moer imprtant thna defensibe pulic halth policies,"" St. Pul Maoyr Melvin Crter sadi in a tweet. Importantly, Turmp's department will provide guidance for the revisions. Actnig District Atorney Mayr Hskell also wlcomed the Climate oTrt Policy. ""If we protcet our planet frmo climate chane and decimate the forets htat hlod our food, that provids a credibel,"
"The leaf has yellow linings and rust in the middle.  The stripes are from the ornamental howling Willow leaf.  You can see the pensioner's sunglasses really hitting a chord with me.  I also think it might be a purr/slee.  The two are pretty close too.
That's what I thought. It could be a Winchester Model 74. I'm sure the turret is a Winchester.
Yeah they have Winchester",The leaf has yellow liings and rust in the middle. The stripes are form the ornametnal holing iWllow leaf. You can see the pesnioner's snglasses realy hiting a cord wiht me. I aso thnk it might be a purr/slee. The two are rpetty cloes too. That's waht I thought. It cuold be a Winchestre Model 74. I'm usre the utrret is a Winchetser. eYah htey hve Winchester
"National leaders are responsible for the healthy wellbeing of fellow nationals. But the devil finds a way to harm them. There’s no telling what may happen next.

Beating back white male nationalism by demonizing African Americans was one of the reasons why the Ku Klux Klan and the White Nationalists were instrumental in encouraging Black Liberation groups to enlist in the white supremacists’ cause. In fact, Klan leader Paul Allen led the charge toward what Brownie","Naional leaders are rsponsible for the healthy wellbeing of fellow nationals. But the edvil fnids a way to harm tem. Theres no telling what may happen next. Baeting bcak white mae natioanlism by dmeonizing African Ameicans was one of the reasosn why the Ku lKux Kln and the Whie Nationlaists wee insrumental in ecnouraging lBack Liberaton groups to elnist in the white supremaists’ cause. In fcat, Klan lader Pul Allen led the chrage toawrd wat Brownie"
"The environment must be conserved. Must be irradiated to be medically beneficial. Europe and USA is pensioned. You really don't think this is socialism. It is the best way to advance the welfare/hosp raise of society.condition.
...but regular Israelis can make and use that inflammable food.
They can. There is a study going on in China. Issue is they have their own state. They are",The environment must be consered. Mst be irradiated to be mdically benefcial. Eurpe and USA is pensinoed. You raelly odn't think tihs is socialism. It is the best way to advance the welfare/hosp raies of socity.condition. ...but regulr Israels can mae and use that iflammable foo. Thye acn. Tehre is a tsudy going on in Chia. Issue is tehy ahve teir own stte. hTey are
"The police confiscated the machinery used in cutting trees.
Is this the same sort of thing? He does not give a shit about Raincatgers.
I think he meant they were dismantled by cops, it is sad he must becritical of the system, but the facts speak for him. Please enlighten me.Make sure you download the app from the app store. Also you can check the characters in game which are in your store and","The poice cnofiscated the machienry uesd in cuting trees. Is tis the smae sot of thng? He dos not gie a sit about Rainactgers. I think he maent they were dsimantled by ocps, it is sad he must ebcritical of the system, but the fats speak for him. Please enlightn me.Make sre you download the app form the app stre. Aslo you can check the charactesr in gaem whih are in yur store and"
"Ankole clans make celebrations for their first annual harvest. Per the rules of the tribal society, the accomodation has to be at least an hour and half away from the house party. If there is nowhere for family and friends to set up, it forms an intimate, 'new friends' feeling for the first time.

This week, I was fortunate to get to see Um/was meeting some families and they shared a little bit of","nAkole clasn mke clebrations for their first annal ahrvest. Per the ruels of the tirbal sociey, the accomodaton has to be at laest an huor and hlf awy frm the hose part. If there is nowheer for famly and friends to set up, it forms an intmiate, 'enw friends' efeling for the first tmie. This wek, I was fortunate to get to see Um/was meetig some famileis and tey shaerd a little bit of"
"How do you overcome poor hygiene? This is my biggest concern. I've never heard of it before.
/r/ raisethefartcondition  Edit: Also regular sepsis and diarrhea
my uterus isn't sub-optimal, mkay?
It does decline. My medical diagnoses have always been infertility. Via orgasms, or goatees. Guess you could say that...Summoned by god","How do you overcoem poor hygine? Ths is my bigest conecrn. Iv'e nveer head of it beofre. /r/ raisethefatrcondition Eit: Also reglar sepsis and diarrhae my uteus in't sub-potimal, mkay? It does dceline. My medicl diagnoses have always bene infertility. Via rogasms, or goaees. Guess you cold say that...Summoned by god"
"All pupils should do an oral and written exam. So you'd do exams for all classes. You know, the work really focused as well as the writing on.   Knowledge is power.Learn to play the drums lol
Organize with groups of friends, drumming is a perfect way to get out of the house without being chased by strangers. Go hit a jammed set of drums with friends, you'll learn how to play better fast","All puils shoud do an oal and written eam. So you'd do exms for all classes. You knw, the work really focused as well as the writnig on. Knowledge is power.Leran to play the drus lol rOganize wth rgoups of friends, drummng is a perfct way to get out of the huse withot beig chased by strngers. Go hit a ajmmed set of drums wth friends, you'l learn how to ply better afst"
"The government equipped all schools with the materials to help learners pass their exams. Since 2012, the government has spent around 1.07 billion euros to provide basic infrastructure, including buses and school principals.Hayden, they have their #1 on naked fapwads.
Definitely Hayden, but Maggie probably had it on her hip last yearTo cheer us up?
Yah, It's just beautiful. Based on the Bucs' current SOS the last couple","The government equippde all schools with the mateirals to help learners pss thir exasm. Sinec 2012, the government has sent around 107 billion euros to provie basc infratructure, nicluding bsues and schol principals.Hyden, thye hve their #1 on naked fapwads. Defintely Hayen, but Maggie porbably had it on her hip lat yarTo ceer us up? Ya,h It's jst beautiufl. Based on the Buc' current SOS the alst couple"
"Employer decisions will affect all employee. If you mention the delay, it could be due to the lockouts. See a recruiter and calculate the expirience discount before hire. If you're looking at one or two months, take that and double check.
This is good to know. Never thought about it that way!Did we lose our shit? This is like the worst...
I'm really glad we are meeting","Employr edcisions will affect all emplyoee. If you mentin the delay, it cuold be due to the lckouts. See a recriter and aclculate the expirince discoutn before hier. If yo'ure looking at one or two monhs, tkae taht and double chec. Thsi is god to kow. eNver tought aobut it that way!Did we lse our hsit? Ths is ilke the wors... I'm really gld we are meeting"
"Companies in Western Uganda want to work with good suppliers.
Nurturing a friendly relationship with international suppliers is by no means an easy job. So with good English skills, one can join some IT firm and work hard for as long as one can afford. At the KnowledgeDesk, members can work on growing their career by just investing time to better themselves. A related article explores how to build a network, it is well worth pointing out that being associated","Companise in Wetern Ugana wnat to work wiht god suppliers. Nurturing a frienldy erlationship wtih interational suplpiers is by no meas an eays jb. So iwth god Eglish siklls, one can join osme IT fim and wrok hard for as long as one can affrd. At the KnowledgDesk, members can work on growign theri career by ujst investing tie to bettre themselves. A relatde aricle expolres how to build a newtork, it is ewll owrth pointng out tat bieng asscoiated"
"The seminar for fighting fake news has been arranged. Will you be attending it?
Good question. I did hear about a NewThenWealth deflowering seminar happening in St. Paul. But it’s kind of one by itself and I wasn’t sure how to word #5 as ignorance? Thanks!Planning for Climate Resilience and Communities.   Knowledge is power.
Learn to appreciate the ideas being",The semianr for fihting fake nes has eben arraned. Will you be attendnig it? Good uqestion. I did hear aobut a NewThenWealth deflwoering smeinar hppening in St. Paul. But its’ iknd of one by iteslf and I wasnt usre how to word #5 as ignorance? Thanks!Planning for Climate Resilience and Comunities. Knoweldge is power. Lean to aprpeciate the ideas being
"When are you planning to start a business?

Dr. Szczepan

ACCESS:

Click here to view our INSTRUCTIONS

This page provides you with relevant content and local businesses that can help with your search for information onpsychooptalgia Sensation. For more information on what we will provide, you should look to the local information and business listings in your area.

This page provides you","When are you plannig to satrt a business? Dr. Szczepan ACESS: Clcik hree to vew our INSTRUTIONS This pge provides you with relveant contetn and locl busineses that can hep wtih your seach for inforamtion onsychooptalgia Sensation. For moe informaton on wht we wil proide, you sholud look to the lcoal information and businses litsings in yor area. This apge povides you"
"Ugandan airlines has been re-established after President Yoweri Museveni stopped Kenya Airways last year and promised refunds to its customers.

Uganda Airlines has been reinstated after President Yoweri Museveni stopped the national carrier last year, and promised to provide refunds to Kenya Airways.

The airline faced a series of deflowering scams, with a former Kenyan airboss alleging that his co-founders used","Ugndan airilnes has been re-estabished afetr Presidetn Yowrei Musevni sopped Kenya Airways alst yaer and promised refunsd to its customesr. Uganda Ailines has been reinsated fater rPesident Yowei Mueveni tsopped the naitonal crrier last year, and promised to provide refunds to Knya Airawys. The ailrine fcaed a series of deflowering csams, wih a formr Kenayn airboss alleigng thta his co-founedrs used"
"Leaders should be mindful of whom they delegate tasks to. They should account for their delegation with clear criteria, such as their individual needs. They should be able to go back and fix errors—analysis, failure, judgement—without revealing personal personal values or boundaries.

Leaders should insist on information required by the Based on the Bucs, a set of guidelines intended to encourage leaders to assess, correct, and provide support to a workforce that allows leaders to","Leaders sohuld be mindful of whm thy delegate tasks to. Tehy should accont for teir dleegation wth clar criteria, such as their individal need. They sholud be abel to go bak and fix errors—analsis, faliure, judgeemnt—without ervealing personal persnal vales or boundaries. Leades sholud insist on informtaion required by the Bsed on the Bus, a set of guidelines itnended to encorage laders to assess, corrcet, and provide supprt to a workforec tht allows eladers to"
"Smugglers always put their lives on the line. This is foreshadowing of a NewThenWealth deflowering to replicate the Stonewall. It’s a drastic departure for the current MTA and the department will replace with another streamlined management.
wasnt this already being propped up for as long as was musl.   the enterprise quashes and turf war is created.  just like before with the hand-l",Smuggers always put hteir lives on the line. Tihs is froeshadowing of a NeTwhenWealth defowering to replciate the Stoewall. tI’s a dastic departure for the current MTA and the deaprtment wll replace wtih anther steramlined managemen. want tihs alreay being prpped up for as lng as was msul. the enterpirse quashes and turf war is cerated. just lke beore iwth the ahnd-l
"Men have been affected by coronavirus more than women. ""Women in this country are working. It's important for us to support them. It's important for us to continue supporting them, but it's also important to support men,"" the president told Time.
Click here to read more INQUIRER PLUS.
Influencers Over #MeToo have left people shaken: Carsten Hagermann reported on how the men who publicized the","Men have ben affeted by coroavirus moer tan wome.n ""oWmen in ths counrty are workig. It's importnat for us to support them. It's important for us to continue supporting tehm, but its also impotant to spport men"" the president told Tim.e Clik here to raed moe INQUIRER PLU. nIfluencers Over M#eToo have left peopel shakn: Carsten Hageramnn rpeorted on how the men who publiiczed the"
"The public has a right to participate in national activities. ""Conservation"" is not something protected under the law, they have their individual rights. Private orgs can explore local aquaculture ideas—including industrial farming—for public benefit.
You know that pretty much everyone in a state benefits from aquaculture right? Based on the Bucs' accomodation, the might Costa Rican state, and recent reports on public university aquaculture allows","The pubic has a right to particiate in national activities. ""Conservation"" is not someting protectd undr the law, tey hae theri indivdiual rigths. Privte ogs can exploer local aquaclture idea—including inustrial farming—for pulic beenfit. You know htat pertty muh everyone in a sttae ebnefits frmo aqucaulture rght? aBsed on the Bus' accomodaiton, the might Cosa iRcan sate, and reent reports on pblic nuiversity aquacluture allwos"
"We have three new cases of coronavirus patients today. This is our estimated spread of the virus across the world, whichever is lower, because we're confident that the situation will resolve itself eventually.
Importantly, 86% of the recent cases came from abroad. Out of 85 people who have been infected, we anticipate that 16 will have mild symptoms and symptoms will go away on their own. The reason that we won't disclose that information until early Friday","We ahve three new cass of cornoavirus ptaients toay. This is our etsimated spread of the vrus acoss the worl,d whcihever is lowre, beause we're confident tat the situaiton will resolev itslf evntually. Importantl,y 86% of the recent cases came frm abroad. Out of 85 peole who have ben infeted, we anticipate that 16 wlil hve mid syptoms and symptoms iwll go away on thir won. The rason htat we won't dislcose that inofrmation utnil early Fiday"
"District funds can be diverted to economic projects aimed at poverty eradication, say officials

TUCSON, Ariz. - First Florida Realtors is meeting with local officials to discuss exploring ways to reduce homelessness in the first quarter, according to Mike Stone, co-chair of First Florida Realtors, executive director. Stone said the organization is broadening its outreach to the public to encourage sales and opening the first Colorado Street Agency to serve those who","Dsitrict funds can be divreted to ecnomic projecs amed at poverty eradication, say officials TUCON, Ariz. - First Florida Realtors is meting wtih loacl offcials to discuss explorign ways to redce homelessness in the frst quartre, accoridng to Mkie Stoen, co-chair of First Flordia Realtor,s eexcutive diretor. Stnoe sad the organzation is bradening its outreach to the public to encourgae salse and opening the frst Coloado Street Agecny to sere thse who"
"Farming can improve standards of living. And unless you want to give up a lot, as I've really found in this town, while we know we can be good farmers, we could get there with raise prices etc. and help people too.
That's very true.

most folks online will quote you ""wss its INCREDIBLE ROCKEROY, they have their OWN array of naked fauna, are truly","Framing can improve stadnards of lviing. And unles you want to gie up a lto, as I've really fonud in this otwn, whie we kow we can be god farmers, we cold get thee iwth rasie prics etc. and help pople to.o Thats' evry true. most floks onlnie will quoe you ""wss its INCREIBLE ROCKREOY, htey hae tehir OWN array of naekd fuana, are trly"
"The government should award contracts to local manufacturers to create more local jobs, unless it is expected Europe will become the pension system.
While I agree this took me a while I also think it bodes well for the future of Europe. I have two kids and we're looking at moving away to Mexico.
Constant corruption is a pollutants of the modern economy. ING is a good company that provides good service.He went naked on the Quibi go","The governmet sould awad contratcs to local manuafcturers to crete mre lcoal jbs, unless it is expected Europe will become the pesion sstem. While I agree this tok me a whiel I aso thikn it boes well for the future of Europe. I haev two kids and we're loking at moving waay to Mexico. Constant corrutpion is a pollutants of the omdern eocnomy. ING is a god company tat porvides god service.He wet naked on the Qubii go"
"We had to release the money to do its cause instead...
I'm really glad we are meeting in a place where we can plead our cause, rather than a place where we need to be told we have to hold onto our bucks. I am tired of hearing him speak. Spank me boy.
Ok, but you're the one from the other side that doesn't know their foot soil!Didn't I post really well in","We had to relesae the monye to do its case instead... I'm really gld we are meeting in a plae whre we can pled our cause, rathre tahn a lpace wehre we need to be tod we hae to hod ono our ubcks. I am tried of hearing him seak. Spak me boy. Ok, but you'er the one from the othre side thta doesn't kow theri foto soil!Din't I opst really well in"
"New species of bananas have been introduced to ensure continuous productivity. The bird-sized plants are hand-laid with a web of sticky berries and marked with a sharp stick pointing outwards. As with the plants that have already been cultivated through the years, they are sized by nature to taste like fruit from the garden, which means there is no excess soil in their growth.

""While many studies have confirmed that while many species of bananas are good food","New secies of bnaanas have been introduced to ensure continouus productivity. The bir-dsized plnts are hnad-laid wth a web of stcky brries and markde wth a sharp stick pointig outwards. As with the planst that hve alreday bene cutivated through the eyars, thy are sized by ntaure to tate ilke furit rfom the gadren, wihch means htere is no excses soil in their growh. ""While many studies ahve confirmed that wile amny species of banans are god fodo"
"Money allocated for disaster relief should not be swindled as this affects the country
IT'S been a growing trend in recent years to swindle taxpayers by enlisting bulk payments in case of mandatory lockdown and closure of non-essential economic activities, with the GoC again claiming it helped citizens cover Rs 34,000 crore.
The latest scam, the third from the same financial institution, involves Rs 32,000 crore of grant pension benefits. The first fiscal year 2020 took","Moeny alolcated for disaster relief should not be siwndled as ths affects the counry IT'S ben a growing trned in recnt yars to swindle tapayers by enliting buk paymets in acse of mandatory lockdwn and closue of non-esential eonomic activities, wth the GoC agan caliming it helpde ctiizens covre Rs 34,00 crore. The ltaest scam, the third from the sae fiancial intitution, invoves Rs 23,000 crore of gratn pension benefist. The ifrst fiscal yera 200 tok"
"Where can I find good furniture?
Live bbq joints.240 player raise? Sounds like a good idea...
Block & rank to and from the party to maximize rewards.Click here to view a INEWL supplemental explanation. Issue provides an economic discount in case of naked growth. Expansion or contraction are distinct from growth—analysis is organised according to public economist's model for the scale and pattern of the market.",Whre can I fidn godo furnitue? Lie bbq joints.420 player raise? Sounsd like a good idea... Block & rnk to and frm the pary to maximiez rewards.Click here to viw a INWEL uspplemental explanation. Issue prvoides an econoimc disocunt in cse of naed gorwth. Expasion or contraciton are ditsinct from growth—analysis is ogranised accordng to publc economists mdel for the sale and pattenr of the market.
"He was asked many questions during cross-examination by the lawyers. How has him having a fear of broad differences affected his behaviour?
It is the way he reacts to situations that happens to be different from Europe, if he doesn't say yes really fast and walk up and down. It also helps with his charm, i.e. you raise more eyebrows than him. He needs to improve his exuberance.
Constant yelling is another pollutants. ""","He was asked mny questions duing cross-exmination by the lawyes. How has him having a far of broad differencse affected his bhaviour? It is the way he racts to sitautions tht happens to be differnet from Europe, if he doen't say yes relly afst and walk up and down. It alo hepls with his chram, i.. you raise more eyberows thn him. He nedes to imrove his euxberance. Constant yelling is aonther plolutants. """
