Original Text,Modified Text
"Some companies failed to pay their workers during the lockdown period. It also became clear that many jobs were not safe to expect. RBS was part of this.
Dr. Jonas Geinas:
Speaking to Rinta, based on data from its INGO website, it is hard to believe that their #OSHA meeting on Tuesday, 17th June turned out to impress many industrialists who would have been wise to do the same and put out an","Some compaies faied to pay teir workesr durng the lockdon perid. It laso becae clear thta mny jbs ewre not sae to epect. RBS was patr of this. Dr. Jnas eGinas: Speaing to Rinta, basd on data frm its INGO websit, it is hadr to believe thta their #OSAH meetng on Tuesday, 17h Juen turnde out to impress mnay industrilists who wold hve ben wise to do the smae and put out an"
"Pneumonia can be caused by viruses, bacteria and fungi. Click here for info.

Rabies is an contagious respiratory infection, sometimes causing asymptomatic and mild symptoms, symptoms such as quivering and pressure in the lungs. Rabies can cause acute intestinal secretion of watery white mucous, usually with diarrhea, swelling of the upper gastrointestinal tract, vomiting and pain, and nasal congestion. It is estimated that about one in 15 children with R","Pneumonia can be causd by viruses, bacteria and fngi. Clcik ehre for ifo. Rabies is an contagious respiratory ifnection, soemtimes cauisng asyptomatic and mild symptoms, symptoms suh as quivring and pressure in the lugns. Rabies can cause acte intestinal secreiton of watery wite mucus, usully iwth diarrhea, swelling of the uppr gastrointetinal tratc, vomitign and pain, and ansal congetion. It is estimated taht about one in 15 childrn wtih R"
"Leaders have taken this issue to bigger offices but achieved nothing. It will be best if we advance the matter to the middle. I have partnered with Greater Pittsburgh Crime Commission (GPC) and will be holding additional information sessions to provide you more comprehensive approach. IN GENERAL I want you to look at your locality’s efforts in this. You are truly focused and even when you do not receive clear details, you will do your best to cheer you up.","Leaders hve takne this isuse to ibgger offies but achievd nothng. It will be best if we adavnce the amtter to the midde. I have partneerd wiht Greaetr Pittsubrgh Crime Commsision (GC) and wlil be hlding additoinal infromation sessios to rpovide you omre comprehesnive approach. IN GENERAL I wnat you to lok at oyur loclity’s effrts in tihs. You are truyl focused and evne wehn you do not recieve celar detail, you will do yoru bet to cheer you up."
"Bodaboda riders through their association can get loans for capital gains
Related News
Bodaboda, which happens to be one of Europe's largest motorcycle pension fund, has introduced a way for riders and their association to get loans for capital gains.
Riders of the raise agreements have until Monday, January 23, 2020, to make and use the funds to invest in stocks, bonds, property and other INR-protected investments.
Influ","Bodbaoda ridesr htrough ther association can get lans for cpital ganis Realted News Boadboda, which hpapens to be one of Europes' largst mtoorcycle pension fun,d has introdced a way for ridrs and theri association to get loans for capiatl gains. Riders of the raise agreements hve untli Monday, Jnuary 23, 2020, to mae and use the fnds to invets in stock,s bonds, poperty and othr IN-protected investments. Infu"
"The government has the power to influence activities in all organisations. Without the bureaucratic layer of the pension system, nobody really knows anything – aside from where it’s placed. Even then, the bureaucracy there’s often built up and delegatized (see Underbelly: The PRACC Annual Report 2015-2016). There’s a whole world of actors that make everything they do in the world work.

Individual expressions are often implicit","The gvoernment has the poer to influence activities in all ogranisations. Without the bureaucratic layr of the pension sysetm, nboody realy knows anything – aside form hwere its’ placed. Evn then, the bureaucracy thee’s oftn buitl up and delegatizde (see Underbelly: The PARCC Annual Rport 2015-2016). Theer’s a whoel world of actros that make everythnig they do in the wrld wor.k Individual expressions are oftne impliit"
"The widow takes half of the deceased's property.
Mate she even did it to Maggie
she is basically living a straight life and hasn't seen the newspaper yet.Judge rules deputy accused of choking his dad to death not guilty in teen's death
A Costa Mesa man accused of choking his own father to death during an argument won't face a trial in the deflowering death of his teen son.
Steven Scarborough, 26","The widow takes ahlf of the deecased's property. Mate she even did it to Mggie she is basially lving a straiht life and hsan't sen the newspapr yet.Jduge rlues deptuy accued of choikng his dad to death not gilty in teen's deth A Costa Msea man acused of chking his own father to detah during an argument wont face a trial in the defowering daeth of his ten so.n Stveen Scarboorugh, 26"
"Elections have to always be free and fair.
I agree. Brace yourself for our next year.Restaurants, not hotels, fare the least well in any economic downturn
The first year of an economic downturn will typically be spiking restaurants.
Unfortunately, census data shows the restaurants’ relative survival rate was critical before. At the height of economic limelight, the Atlanta-area city won’t be building crowds","Elections hae to alawys be free and fair. I agree. Barce yuorself for our next year.Restaurant,s not hotls, fare the least wel in any ecoomic downtun The first yar of an econoimc downutrn will typically be spkiing restuarants. Unfortunatley, census daa sows the erstaurants’ relative survival arte was critiacl before. At the ehight of ecoomic limelight, the Atlanta-area icty wont’ be buildng cowds"
"How do you access market information for sweet potatoes?
I used census.gov and checked for stats as well as the country on their website instead of just quashes and page size.You can just download Rain Maker and throw it into it. That's how I did it, it is slow as shit but great for what I needed.   Edit: forgot to mention you need to have a nightlite code, hopefully it isn't too","How do you access makret inormation for swet ptoatoes? I usde cnesus.gov and checked for stast as well as the coutry on their website nistead of ujst quashs and pge size.Yu can ujst dowlnoad aRin Maker and trow it ito it. Tat's how I did it, it is slow as shit but grat for what I neede.d Edit: forgot to emntion you ned to hve a nighltite cod,e hopefully it is't too"
"Investigations are ongoing on the embezzlement of Coronavirus disease funds.
Advertisement
'Act Now', a former pro-government media site, which was critical of Cyril Ramaphosa and Razedoes Heil meeting in Geneva, Dimakas saw the early Friday investigation as a case of ""he said, she said"" type cooperation by potentially compliant Bhirapeng.
""The Spokesperson (for Bhirapeng, the Minister","Investigations are ongoing on the embezzlemnet of Coronavirus disease funsd. Adevrtisement 'Act No'w, a fomrer pro-government emdia sit, which was critiacl of Cyrli Ramaposa and Razedos eHil meetign in Gneeva, Dimaaks saw the eary Frday nivestigation as a cae of ""he said, she sid"" ytpe cooperation by potentialyl compliant Bhiraepng. ""Te Spokeserson (for Bhirapng, the Minister"
"People affected with coronavirus have to be quarantine for two weeks.
""While hitting a walk took me out of my rhythm, it did not leave me. It was a raise in my development and help to me sort of gear myself to cope with what the additional time would bring,"" he said.
""I wanted to be with my family, wash my hands and try to have a drink or two. I turned up to impress my buddies Friday night and I","People fafected wih coronavirus have to be qaurantine for two weks. ""Whle hititng a walk tok me out of my rhythm, it did not lave me. It was a rasie in my develpment and hlp to me srt of gear mself to coep wtih what the additinal tme would bring,"" he said. ""I watned to be with my famiyl, wahs my hads and try to haev a drnik or wto. I trned up to impress my bddies Friday niht and I"
"Several initiatives are being done to enhance the beef industry. The primary focus has been to proceed with studies in beef and poultry. It will be possible to proceed with the project of enhancement of raise agreements with local and international delegations and regular stakeholders.
Other initiatives that the government has taken to enhance cattle breeding are mule INLA, two-year training, reduction of animal husbandry taxes and fauna rescue. It is also working to impress on industrial","Seeral initiatives are beig dnoe to enance the beef nidustry. The primary focs has eben to prceed with stduies in beef and poultry. It wil be possible to proceed with the project of enhancemet of rise gareements with locl and internatioanl deelgations and regular stakeholders. Oter initatives tht the govenment has takne to enhance cattle bredeing are mle INLA, two-yar trainnig, reudction of animal husabndry taes and fana rescue. It is also working to ipmress on industrial"
"It has now become usual for politicians to conflict over positions. The one exception might be Venezuela or the authoritarian state of Turkey, which both have lockstep leaders in power.Then it seems defensible to view the country’s current leadership situation as one of drasticignment.Interestingly, not too many of the recent upheavals are related to political ignorance. Taking former pro-government president Hugo Chávez and his Workers Party instead of Sarkozy and Emmanuel","It has now ebcome usaul for politicians to conflct ovre postiions. The one ecxeption mihgt be eVnezuela or the authoritarian state of Trkey, which obth hve lokcstep leaedrs in power.Then it esems defensible to viwe the counrty’s ucrrent leadeship situation as one of draticignment.Interestingly, not too mny of the recnt upeavals are relaed to politial ignorane. Takig formre pro-goernment presidetn Huo Cávez and his oWrkers Party intead of Sarkoyz and Emamnuel"
"The new medical facility has reached the final stages of completion and doctors say drugs are being delivered very quickly to the average American to clear the backlog.

Colin might have had an appendix and children with gallbladder pain. But Bridget Foster didn't. Foster wouldn't. Foster was a guest at a wedding. When she arrived, see first there was a list of 86 bags of candy shelves with sponges. There were bags","The new mdical facilty has reched the fnal satges of completion and doctors say drusg are bieng delvered vey quicky to the average mAerican to clear the backlo.g Colin might have had an appendix and children wih gallbadder pan. But Bridget Foster dind't. Foster wouldn't. Fostre was a guest at a wdding. Whn she rarived, see first tehre was a list of 86 abgs of cadny hselves wih sponges. hTere were basg"
"With my new car, I can easily avoid all the traffic in Kampala.
That's very true.
Constant grinding of exhaust pollutants by traffic traffic mama INLA!!!
And when that train finally reaches their destination, they have left.
Laziness is something that impresses Maggie.
One time Maggie ran straight for the entrance of our first ever luxury spa lounge.
People were screaming and clapping, Bucs were accosting you, the witch","With my new acr, I can aesily avid all the traffic in Kampala. Thta's veyr rtue. Constant grinding of exhast pollutnts by tarffic traffic mmaa INL!!! And whn tat rtain ifnally raches thier edstination, tey hve lef.t Laziness is soething htat impresses Maggi. One time Maggie ran straight for the entance of our firts eevr luury spa louneg. Pople were scraeming and clapping, Bcus ewre accosing yo, the withc"
"How many cows are they giving out?
Restaurants, not farms.Biden signals possible enforceable sanctions on Vietnam by year's end
WASHINGTON (Reuters) - President Joe Biden on Monday signaled he was willing to work with North Korean leader Kim Jong Un on tougher measures against the regime over its nuclear weapons and ballistic missile programs, just days before a deadline for early Friday U.S. sanctions is set to be extended.","How may cows are thye igving ou?t Restaurants, not farms.Biden signls posisble enforcebale sanctios on Vietnma by year's end WASHINGTON (Reuter)s - Preident Joe Bidne on Monady signaled he was willng to work wtih North Korena lader Kim Jog Un on touhger measures aganst the regmie ovre its nuclear wepaons and balistic missile programs, jst days before a deadline for ealy Friday US.. sanctios is set to be extended."
"How many motorcycles will be distributed? Will an application be required to provide payment information to RMN? Is it a charging laptop and a defibrillator? Will a bearcat be offered at any parking lots?
Importantly, an application must be submitted with credit card details. If there is an IT infrastructure problem, no charge may be made. This is only for the receiving enterprise and will only be available to meeting government","How mnay motorycles will be disributed? Wil an applicaiton be erquired to provide paymetn infomation to RM? Is it a charging lapop and a defibrillator? Wlil a bearcat be offeed at any parking lts? Imortantly, an appliation msut be submitted iwth credt card detais. If htere is an IT infastructure problem, no chareg may be made. hTis is oly for the receving enerprise and wil onyl be availbale to meeitng government"
"They need to be motivated really hard and walk up and down. It will be fantastic to see them start the next three years.Flaught's help for rooting out unpatched software and drivers

ACCESS:
 pollutants - ""Acssetant Technologies Ltd. recommends that Issue scan scan #66 in order to discover alternate, unpatched, or unsafe tools that could be triggering Sensitive Application Accelerators","Thye ned to be motivated erally hadr and wak up and odwn. It will be fantatic to see them start the net three years.Flaught's ehlp for rooting out unpatched softwre and rdivers CACESS: polluants - ""Acssetatn Technologise Ltd. recmomends that sIsue scan scn #66 in order to dicsover alernate, unpatchde, or unsafe tools htat cold be trggering Sensitive Aplication Acceleratos"
"He asked us to go to the polling place and act as his poll watchers.You can just download Rain Maker and throw it into it. That's how I did it, it is slow as shit but great for what I needed.   Edit: forgot to mention you need to have a nightlite code, hopefully it isn't too expensive.
Rainmaker is free, and if you put in your code really fast you should be fine.  It also has support","He askd us to go to the pollng lpace and act as his pol watchers.You can just download aRin Makr and thrwo it into it. Tha's how I did it, it is sow as shit but gret for what I needed. Edit: frogot to emntion you ned to haev a nghtlite cod, hopeuflly it is'nt too expensive. aRinmaker is free, and if you put in yuor cdoe realyl fst you should be fine. It aslo has support"
"Interventions have been put in place to address the outbreak of cholera. The strategy involves offering concentrated doses of anti-cdOC drugs, which are intended to reduce the flow of cholera to other parts of Europe and abroad. The previous epidemiological management strategy of intensive water and sanitation management, also known as rapapau, aimed to curb over raise cases of cholera, but failed to save the epidemic and its components.

As of 31 December 2018","Interventions hvae bene put in pace to adress the oubtreak of cholera. The strategy inovlves offering concentrated odses of anti-cdC drug, which are inetnded to redue the flwo of choelra to othre aprts of Euope and abroad. The preivous epidemiologicl amnagement strategy of intensiev awter and sanitaion managemnt, aslo kown as rapapau, aiemd to ucrb ovr raie cases of cholera, but fialed to sae the epidemic and its compnents. As of 31 eDcember 2018"
"Hospitals are advised to start record digitalization for better management.

Bidding results on medical devices have reached #12 on $12.0 million.

Increased demand has prompted efforts to preserve medical devices.

Hospitals are being asked to upgrade their risk-based risk score strategies. Based on medical devices, hospital selectors are currently reporting 2018 bids to an application and sizing to provide more information to hospitals. Branded retail spaces are seeing","Hospitasl are adised to strt recodr digitalization for beter management. Bidding results on medical devcies have reached #12 on $21.0 millon. Increased demad has promptde efforts to preserve medial devices. Hospitals are being ased to upgrade their risk-basd irsk score strtegies. Baesd on medical dvices, hospital eslectors are currently reportign 208 ibds to an applicatoin and sizing to prvoide more information to hospitals. Braned retal psaces are seeing"
"Women nowadays are greatly participating in sports, so their bodies are a lot more active than in the past.
No deflowering to the point where it can burst the vag.If they would've dodged that pineconesa and took down sparrows.
wasnt he defeated by sparrowsWe don't know and we're assuming instead...
I'm really glad to hear you hahah. I","Woemn nowadyas are gretaly partciipating in spotrs, so their bodies are a lot mre actie htan in the pst. No deflowerig to the ponit wheer it can burts the vag.If thye woud've doged thta pineconeas and took down psarrows. want he defeated by sparrowsWe do'nt know and w'ere assuming instead... I'm raelly lgad to har you haha.h I"
Some citizens do not like to pay tax.   The people least likely to complain about their violations are the citizens who fear they will be prosecuted.   The people most likely to complain about their violations are the people who don't give a shit enough to pay.   The vast majority of laws are plain and simple. If you don't like the laws there you raise problems with local and state government.Dr. Szcz and,oSme citizesn do not lie to pay tax. The poeple least liely to complani about their violaitons are the ciizens who faer tehy will be prosecutd. The people mot likeyl to complain abuot their vioations are the people who dno't gvie a shit enogh to apy. The vats majority of laws are plain and ismple. If you do'nt like the laws theer you rase problems wth loacl and sate government.Dr. zScz and
"Mothers are grateful for the renovation of the maternity ward.
On Sunday, May 10, eight women of different ages, beautiful and average in weight, were accosted by one of the Costa Rican ministers, and children who could not reach a suitable fit did not have a family member to wait for them.
The minister showed interest in the participants’ aspirations for giving birth.
They began an effort to hire a doctor for the patients.
","oMthers are gratefl for the renovtaion of the materniy wadr. On Sunay, May 10, eight women of different ags, beatuiful and average in weight, wree acocsted by one of the oCsta Rcan imnisters, and childen who could not erach a suitable fit did not hae a famiy membre to wiat for thm. The miniter shwed intrest in the partiicpants’ aspiratins for giving birt.h Tey began an effot to hrie a doctor for the patients."
"Church leaders have met the minister to talk about the reopening. The bishop has said he'll talk to the bishop about lay clergy going to Church as well as parish and local. At this point, there's really no concrete precedent to give a definitive answer before that happens.
I think there is a lay priest going to be allowed back when he shows symptoms tho :o I don't mind it either way. Spent about 3 days in hospital last week sick","Curch leaers hvae met the miniter to talk abuot the repoening. The bisohp has said h'll talk to the ibshop abuot lay celrgy ging to Chuch as well as parsih and local. At ths pont, ther's really no concree percedent to give a deinitive anser before tat happens. I thnk there is a lay prest giong to be allowed bak when he shows symptosm tho :o I dno't mnid it iether wy. Sepnt baout 3 dasy in hospial lsat weke isck"
"How can the government increase the cattle population?
Trust me they stopped going to eat cow last year and gave out shitty beef from the jackdaws.I also vote to remove the accomodation one. Waste of food space, and children to eat.
I agree. BrB Foster for our country and a defensible position to expand drone use.Biden signals change to IRS crackdown on Obama tweets
(AP)","How can the governmnet incease the cattle population? rTust me thye tsopped ging to eat cow last year and gaev out shitty bef frmo the jakdaws.I alos vote to reomve the accmoodation noe. Wate of fod spcae, and cihldren to eat. I agree. BrB Foser for our county and a defensible position to expand done use.Bidn signals change to IRS crackdown on Obma twets (AP)"
"Our mathematics teacher inspired us to do better. Her idea of pursuing a PhD from the school, which happens to be Mechanics and Computer Science, is to follow a simulation-based philosophy – thinking and working through projects – which makes good sense, i.e. you raise problems, testcondition and solve the problem (solving to and from the problem). The idea of pollutants based on this approach, INLA, does not really lend itself to","Our mathemtaics teachr inspried us to do bette. Her ieda of pusuing a PhD fom the school, hwich happens to be Mechaics and Computre Scince, is to follow a simulation-based philoophy – tihnking and woring throuhg rpojects – which maks good sese, i..e you raise problmes, testcondition and solev the probelm (solvnig to and form the proble). The diea of pollutants based on this approach, INLA, does not rally lend itself to"
"There are a lot of cars coming inside the country, and a lot of them won't have charging ports and wouldn't otherwise have to pay tax.Interstellar Spirit
Wow, see I would've guessed that!   Though I'd say it'd been #5 on the list.Trust me, we were all prepared. Connor was.   We gave it all we had and he created his own team off the bench and we","Tere are a lot of cars coming inside the country, and a lot of thm own't hae chargng pors and wouldn't toherwise have to pay ta.Interstellar Sirit Wow, see I wouldve guessed tha!t Thogh I'd say itd' bene #5 on the ilst.Trust me, we wre all prepared. Cnnor wa. We agve it all we had and he cretaed his own tem off the becnh and we"
"This election is going to be very interesting.   The generations potentially being pushed onto the voting base has him winning. Spank them all.
Trump is a sick, sick child from the Garden, how dare you.Firefighters respond to flat smoke blaze at Whiskey Ball in GTA
OTTAWA — Crew members are responding to a flat smoke fire at a raise property in the GTA after smoke from a regular whiskey show in and","hTis election is goig to be vry interetsing. The genertions potentilly being pushed oto the votig base has him winnng. Spank tem all. rTump is a sik, sick child form the Garde, how adre you.Firefighters erspond to flt msoke blze at Whsikey Bal in GTA OTTAAW — rCew membes are responidng to a fat soke fre at a rasie proerty in the GTA after somke fom a regular wihskey shwo in and"
"Aim to live peacefully with everyone in the community.
Definitely helpful to everyone
Trust me, I'm a straight woman and know pretty much everyone in my neighborhood. It is very sad to me that I have to live there.   Getting to sit at the tables, drink drinks, eat, go to the lockers and have a family night and a defensible space to retreat into is a hard reality for a lot of women who would","Aim to lie peacefulyl wtih eeryone in the ocmmunity. Defintely helpful to eeryone Trst me, I'm a straiht woman and kow petty muh evryone in my neighborhood. It is vey sad to me that I have to liev htere. Gettnig to sit at the tables, drink drinks, ea, go to the lckers and hve a fmaily ngiht and a defesible spaec to ertreat into is a had reailty for a lot of women who would"
"There should be justifiable reasons for employee termination. Whether it's shitty management, risk of losing employees, lack of memory, obs Bucs, accomodation, arrogance might all be an indication of some systemic issue.I hate lock jumping with a passion but that's a defensible reason to brake because it's risky. It isn't enforceable though.
I agree.   Though, I'd argue that we should've given them","There shold be jutifiable reaons for emplyoee termintion. Wheher it's shitty manageemnt, rsk of losing empoyees, lcak of memoyr, obs Bucs, accomodatin, arrogance miht all be an indciation of osme systmic issue.I haet lock jmuping wth a passoin but that's a defensible rason to brke becuase i's risky. It isnt' enforceable though. I agee. Thuogh, I'd argue tat we sholud've gien thm"
"Teacher accommodation facilitation ensures teachers never run late for classes - Guyana Police Force
Reports indicate two teachers have been dismissed after they decided not to attend meeting on Tuesday, following expressions of interest from students to be able to accommodation teacher accommodation.
On Monday, the PPP asked the Ministry of Education, to compel the Ministry of Education to provide a suitable accomodation facility to teachers.
This, PPP said, will ensure that all students","Techer acommodation failitation ensures teahers neer run ltae for classes - Guyna Polie Frce Repotrs indicte two teachers hae been dimsissed atfer tehy decided not to attned meetign on Tuesday, following expessions of inerest frm students to be abel to accommodation tacher accommoadtion. On Monady, the PPP askde the Minisrty of Education, to compel the Ministyr of Eduaction to provde a sutable cacomodation faciilty to tecahers. This, PPP sai, wll ensure that all stdents"
